Category,Product Name
Uniforms & Workwear,Cricket Jersey Full Sleeve
Uniforms & Workwear,Skin Friendliness Reflective Safety Vest
Uniforms & Workwear,Blue School Uniform Blazers
Uniforms & Workwear,Industrial Cooling Vest Age Group: Adult
Uniforms & Workwear,White Disposable Hair Cutting Apron
Uniforms & Workwear,Executive Pant And Shirt Uniform Gender: Male
Uniforms & Workwear,Fire Fighting Suit Collar Type: O-Neck
Uniforms & Workwear,Bath Towels
Uniforms & Workwear,Kiran Protective Coverall Age Group: All Age
Uniforms & Workwear,Blue Fire Retardant Coveralls Gender: Unisex
Uniforms & Workwear,Blue Spunbond Polypropylene Coverall Suit
Uniforms & Workwear,Grey Safety Protective Coveralls
Uniforms & Workwear,Massage Gown
Uniforms & Workwear,Corporate Uniform Gender: Boy
Uniforms & Workwear,Green Reflective Safety Jacket
Uniforms & Workwear,Security Gurad Grey And Black Uniform Age Group: Adult
Athletic Wear,Different Available Mens Green Color Track Pants
Athletic Wear,Mens Casual Joggers Age Group: Adults
Athletic Wear,Ladies Bandana Print Tracksuit
Athletic Wear,Black Polyester Sports Track Pants Age Group: Adults
Athletic Wear,Unisex Stylish Printed 4 Way Lycra Sports Lower Age Group: Adults
Athletic Wear,Regular Fit Casual Men'S Track Pant Age Group: Adults
Athletic Wear,Men's Tracksuit Bottom
Athletic Wear,Mens Sports Wear T Shirt And Shorts Age Group: Adults
Athletic Wear,Hooded Track Suit Age Group: Children
Athletic Wear,Men Printed Multicolor Track Pants
Athletic Wear,Sports Track Lower
Athletic Wear,Fleece Tracksuit
Athletic Wear,Ladies Plain Zip Up Track Jacket Age Group: Adults
Athletic Wear,Maroon Horse Riding Breeches
Athletic Wear,Grey Wetsuits And Dive Skin
Athletic Wear,Polyester Fabric Track Suits Gender: Men
Athletic Wear,6 Colors Mens Black Sport Tracksuit
Athletic Wear,Reebok Track Suit Gender: Men
Athletic Wear,New Design Sportswears Age Group: Adults
Athletic Wear,Printed Jersey Age Group: Adults
Athletic Wear,Stretchable And Comfortable Soft Smooth Lightweight Slim Fit Blue Track Pants
Athletic Wear,Men Printed Track Pant Age Group: Adults
Athletic Wear,Basketball Jersey And Shorts Gender: Men
Athletic Wear,Polyester Cotton Mens Solid Navy Blue Track Pant
Athletic Wear,Navy Blue Sports Ns Cotton Track Pants Age Group: Adults
Athletic Wear,Mens Relaxed Fit Track Pant Age Group: Adults
Athletic Wear,Red Track Suit
Athletic Wear,Sublimation Jersey For Sports Wear Age Group: Adults
Slippers,Mens Chappal
Slippers,Plastic White Slipper For Mens
Slippers,Rubber Mens Black Slippers
Slippers,White Terry Bathroom Slipper
Slippers,Smily Slippers
Slippers,Fabric 100% Biodegradable Disposables White Hotel Slippers
Slippers,Spring Mens Leather Slippers
Slippers,Rubber Mens Slipper
Slippers,Brown Ks000027 Formal Slippers
Slippers,Different Available Ladies Casual Slipper
Slippers,Pink Indian Ladies Leather Slipper Manufacturers
Slippers,Rubber Skin Friendliness Acupressure Slipper (K Star)
Slippers,Acupressure Slipper For Men
Slippers,White Closed Toe Non Slip Hotel Slippers
Slippers,Hotel Slipper
Slippers,Summer Unisex Fabric Close Toe Waffle Slippers Terry Slipper
Slippers,Designer Ladies Slipper
Slippers,Leather Mens Brown Slipper
Slippers,Brown Pu Slippers
Slippers,All Esd Apron With Hood
Slippers,Slipper
Slippers,White Unisex Disposable Bathroom Slipper
Slippers,2051
Slippers,Bath Slippers
Slippers,RONAK PU SLIPPER
Slippers,Different Available Mens Leather Kolhapuri Chappal
Slippers,Women Slipper
Slippers,Grey Shine Slipper
Men's Shoes,Customized Sports Shoes
Men's Shoes,Sports Type Safety Shoes
Men's Shoes,Light Weight Mens Loafer Shoes Heel Size: Low
Men's Shoes,Brown Mens High Ankle Leather Shoes
Men's Shoes,Mens Formal Black Shoes Heel Size: Low
Men's Shoes,Alberto Torresi Men Jaques Black Formal Shoes Size: 6-10
Men's Shoes,Blue Color Mens Sports Shoes Heel Size: Medium
Men's Shoes,Genuine Leather Oxford Shoes
Men's Shoes,Green Mens Mojari Shoes
Men's Shoes,Different Available Men Crocs
Men's Shoes,Brown/White Mens Comfortable Lace Closure Designer Luxury Shoes
Men's Shoes,Formal Wear Men Brown Loafers Shoes Without Lace Up
Men's Shoes,Grey And White Flyknit Mens Sports Shoe
Men's Shoes,Blue Fancy Mens Casual Shoes
Men's Shoes,Black Suede Shoe
Men's Shoes,All Balmain Unicorn Shoes
Men's Shoes,Lace closure Mens Sports Shoes
Men's Shoes,As Per Customer Choice Men-Loafer-Leather-Shoes
Men's Shoes,Rainy Men Branded Sports Shoes With Bill
Men's Shoes,Eva Ladies Pu Slipper
Men's Shoes,Men Sport Shoes
Men's Shoes,Mens Cricket Shoes
Men's Shoes,Gents Canvas Shoes
Men's Shoes,Mens Casual Wear Black Low Heel Lace Up Shoes
Men's Shoes,Fabric Men Shoes Black
Men's Shoes,Multicolor Mens Rajasthani Jutti
Men's Shoes,Brown Mens Leather Pull On Moccasins Shoe
Men's Shoes,Black Action Milano Leather Office Shoes
Ethnic Wear,Red Designer Kurta Pyjama
Ethnic Wear,Thobe
Ethnic Wear,Indian Mens Function Indo Western
Ethnic Wear,Blue Mens Plain Short Kurta
Ethnic Wear,Indian Pink Color  Embroidered  Party Wear Lehenga Choli
Ethnic Wear,Multicolor Mens Cotton Colour Dhoti
Ethnic Wear,mens and womens kurti combo
Ethnic Wear,Men Printed Linen Kurta Age Group: Adult
Ethnic Wear,Machine Made Men Kimonos
Ethnic Wear,10 Colors Mens Cotton Kurta
Ethnic Wear,Yellow Silk Shawl Bag Size: 6*58
Ethnic Wear,Washable Mustard And White Yoke Ladies Dress
Ethnic Wear,Long Length Blouses For Women
Ethnic Wear,Dark Brown Muslim Digitally Printed Party Wear
Ethnic Wear,Dry Cleaning Kids Ethnic Indo Western Wear
Ethnic Wear,Designer Lehenga
Ethnic Wear,Designer Sequin Work Lehenga
Ethnic Wear,Designer Sherwani
Ethnic Wear,Ladies Black And White Japanese Kimonos Age Group: 20-55 Years
Ethnic Wear,Maroon Stylish Kimono
Ethnic Wear,Multicolor Muslim Cap
Ethnic Wear,Lengha Choli Collection Size: Xxl
Ethnic Wear,Indian Kids Cotton Kurta Pajama
Ethnic Wear,Eye Catching Look Mens Kurta Pajama Age Group: M-38 To 3Xl-44
Ethnic Wear,Multicolor Bridal Lehnga And Groom Sherwani
Ethnic Wear,Indo Western Suits Age Group: 18To40
Ethnic Wear,Mens Full Sleeves Soft Cotton Kurta Pajama Set
Ethnic Wear,White Mens Lining Fancy Netaji Kurta Pajama
Safety Shoes,Available In Different Color Pulse Safety Shoes
Safety Shoes,Leather Ladies Safety Shoes
Safety Shoes,Custom Safety Shoes Insole Material: Eva
Safety Shoes,Black Industrial Safety Shoes
Safety Shoes,Derby Safety Shoe
Safety Shoes,Mens Safety Shoes
Safety Shoes,Safety Shoes Industrial Leather Safe One
Safety Shoes,Labor Shoes
Safety Shoes,Vaultex Brown Safety Shoes Size: 6-11
Safety Shoes,Available In Different Color Heavy Duty Mens Safety Shoes
Safety Shoes,Black &Brown Safety Shoes
Safety Shoes,Black Dip Safety Shoe
Safety Shoes,Police Tan Leather Boot Insole Material: Pvc
Safety Shoes,Black Avengers Rigger Boots
Safety Shoes,Pvc Gumboot
Safety Shoes,Pure Material Safety Shoes
Safety Shoes,Leather Ladies Safety Shoes
Safety Shoes,Multicolor Double Density Pu Sole Safety Shoes
Safety Shoes,Allencooper safety shoes
Safety Shoes,Blue Honeywell Hsp500Xc Sporty Safety Shoes
Safety Shoes,Brown Safety Shoes Insole Material: Pu
Safety Shoes,Black Ankle Height Quick Release Boots
Safety Shoes,Men Pure Leather Safety Shoes Grade: A
Safety Shoes,Silver Aluminum Safety Shoes
Safety Shoes,As Per Requirement Black Pu Safety Shoe
Safety Shoes,Black Derby Safety Shoes
Safety Shoes,Brown Fs61 Karam Safety Shoes
Safety Shoes,Black Leather Safety Shoes
Safety Shoes,Black Allen Cooper Shoes
Safety Shoes,Leather Safety Shoes
Safety Shoes,Black Low Back Safety Shoes
Nightwear,Printed Night Wear Hosiery Night Suit
Nightwear,Multicolor Ladies Short Sleeves Nighty
Nightwear,Loungewear Single Jersey
Nightwear,Cotton Front Open Night Suit
Nightwear,Various Colors Are Available Women Sleeveless Top And Short For Night Wear
Nightwear,Violet Ladies Night Suit
Nightwear,Rainy Ladies Printed Cotton Nighty
Nightwear,Cotton Ladies Nighties
Nightwear,Women nighties
Nightwear,Cotton Kaftan Nighty
Nightwear,Any Color Ladies Printed Cotton Nighty
Nightwear,Blue Women'S Night Suit
Nightwear,Multiple 100% Premium Cotton Ladies Full Sleeves Printed Night Suit
Nightwear,Sleeveless Round Neck Single Jersey Fabric Ladies Pajama Set
Nightwear,Winter Royal Satin Printed Nighty
Nightwear,Cotton Ladies Solid Red Night Dress
Nightwear,Multicolor Combo Pack Night Suit
Nightwear,Cotton Nightwear
Nightwear,Comfort to Wear Cotton Gown
Nightwear,Sara Panties
Nightwear,Ladies Blue Jay Sleepwear
Nightwear,Different Available Ladies Cotton Beautiful Print Nighty
Nightwear,Plain Mehandi Velvet Night Suit
Nightwear,So Many Color Will Come Women'S Tribal Ethnic Print Kaftan
Nightwear,Cream Zil Mil Vol 4 Designer Cotton Printed Night Wear
Nightwear,Multicolor Ladies Digital Printed Nightsuit
Nightwear,Different Available Blue Ladies Nighty
Nightwear,Girls Loungewear Night Suit Set
Shorts,Beach Short
Shorts,Sports Shorts
Shorts,Blue Mens 3 Quarter Pant With Side And Back Pocket
Shorts,Men'S Shorts
Shorts,Mens Shorts Gender: Male
Shorts,Mix Shorts Lexon
Shorts,Mens Plain Boxer Shorts
Shorts,Blue Cycling Shorts Wear
Shorts,All Colour Comfort To Wear Evolove Short
Shorts,Mens Cotton Shorts Age Group: Adult
Shorts,5 Knee Length Men Shorts
Shorts,Mens Casual Bermudas Age Group: Adult
Shorts,Sports Shorts (1085)
Shorts,Designer Shorts
Shorts,Cream Ladies Shorts
Shorts,Multiple 100% Cotton Mens Shorts
Shorts,Denim Shorts
Shorts,Navy Blue Printed Shorts Age Group: Adult
Shorts,Mens White Comfortable Disposable Boxer Shorts with Fine Finish
Shorts,Available In Multiple Color Ladies Denim Fancy Shorts
Shorts,Mens Black Shorts Combo Gender: Male
Shorts,Girls Cotton Shorts
Shorts,Dark Green Ns Lycra Running Shorts Age Group: Adult
Shorts,Ladies Short
Shorts,Ns Lycra 8% with Tighty Inside
Shorts,Mens Gym Shorts Gender: Boy
Shorts,Angelina Printed Boys Bermuda
Shorts,Different Available Ladies Printed Boxer Shorts
Jute Bags,Brown Jute Plain Shopping Bag
Jute Bags,Food Grain Jute Hessian Bags Design Type: Customized
Jute Bags,Golden Jute Shopping Bags
Jute Bags,High Quality Jute Jute Bags
Jute Bags,Brown Zipper Jute Bag
Jute Bags,Jute Gunny Bags
Jute Bags,Fancy Jute Carry Bags
Jute Bags,HOOGHLY Jute Bags
Jute Bags,Jute Bags
Jute Bags,Multicolours Jute Laptop Bag
Jute Bags,Brown Eco Friendly Reusable Jute Carry Bag
Jute Bags,Brown Jute Sacking Bag
Jute Bags,Brown Jute Travel Bags
Jute Bags,Jute Bag
Jute Bags,Customize Jute Bags In Kanchipuram
Jute Bags,Promotion Or Designer Jute Bag Usage: Shopping
Jute Bags,Brown Handmade Jute Bag
Jute Bags,Jute Sling Bag
Jute Bags,Fancy Jute Bags
Jute Bags,ABBAY Jute Bags
Jute Bags,Different Available Jute Promotional Laptop Messenger Bag
Jute Bags,Different Available Jute Shopping Bag
Jute Bags,Custom Jute Bag
Jute Bags,Handle Jute Bag Usage: Gift
Jute Bags,Different Available Jute Handy Bags
Jute Bags,Hessian Jute Bags
Jute Bags,Light Brown Jute Shoulder Bags
Jute Bags,Jute Executive Bag
Jute Bags,"Raw Jute Bags Baler In Ahmedabad Oham Engineers, Control Type: CNC"
Jute Bags,Brown Plain Jute Bag
Jute Bags,Brown Tear Resistance Easy To Carry Printed Jute Lunch Bags
