Category,Product Name
Women Wear,Lime Yellow Trendy Women Hooded Sweatshirt
Women Wear,Dry Cleaning Beach Pants
Women Wear,Washable Ladies Pink Double Layered Cotton Anarkali Suit With Jacket
Women Wear,Womens Wear
Women Wear,Womens Wear
Women Wear,Black Ladies Party Wear Blazer
Women Wear,Washable Pocket Front Buckle Belted Shirt Dress
Women Wear,Ladies Cotton Crop And Shorts
Women Wear,Designer Casual Wear Ladies Gown
Women Wear,Indian Art-3110  Ooshin Uk Gold Light Grey
Women Wear,Indian White Georgette Floral Print Long Dress
Women Wear,Indian Priya Wonder Color Short Sleeves
Women Wear,Washable Blouse Cups Laminated
Women Wear,Pitch Long Poncho Gown
Women Wear,Red Ladies Bridal Silk Lehenga
Women Wear,Ladies Black Color Gown Bust Size: 38 Inch (In)
Women Wear,Washable Ladies Plain Palazzo
Women Wear,Sarten Dress
Women Wear,Printed Ladies Cotton Pyjama Set
Women Wear,Washable Ladies Elastic Waist Leggings
Women Wear,Washable Ladies Rayon Kurti Palazzo Set
Women Wear,Indian Bridal Embroidery Lehenga
Women Wear,Different Available Party Wear Indo Westerns
Women Wear,Indian Dungarees  Dress
Women Wear,Designer Georgette Suit
Women Wear,Ladies Half Sleeves T-Shirts Bust Size: 34-42 Inch (In)
Women Wear,Any Color Ladies Palazzo Set
Women Wear,Indian Ladies Embroidered Sharara
T-Shirts,Multicolor Mens Black Regular Fit T-Shirt
T-Shirts,UrGear Printed Men Round Neck White T-Shirt
T-Shirts,Mens Casual Polo T-Shirts Gender: Male
T-Shirts,French Terrain Sports T-Shirts
T-Shirts,Black And Dark Red Organic Cotton T Shirt
T-Shirts,Mens Plain T Shirt
T-Shirts,Men Short Sleeves T Shirt Age Group: Adult
T-Shirts,Mens Polo T Shirts
T-Shirts,Grey Mens T Shirt
T-Shirts,Red And Black Mens Half Sleeve Sports T-Shirts
T-Shirts,Gents Shirts
T-Shirts,Lexon Cotton Lycra Round Neck Full Sleeve T-shirt
T-Shirts,Mens Regular Fit Dry Rose Colour Polo Neck Solid T-Shirt Age Group: Adult
T-Shirts,Mens Polo T-Shirt
T-Shirts,Multicolor Orange Colour T Shirt
T-Shirts,Multicolor Mens Zipped T Shirts
T-Shirts,Mens Polo T Shirt
T-Shirts,White And Navy Blue Half Sleeves Mens V Neck T-Shirt
T-Shirts,Half Sleeves Round Neck T-Shirt
T-Shirts,School Sports Polo T Shir Age Group: All
T-Shirts,Mens T-Shirts Machine Weight: 5  Kilograms (Kg)
T-Shirts,Promotional T Shirt
T-Shirts,Cotton Women White Plain Collar T-Shirt
T-Shirts,Red Promotional Polo T-Shirt
T-Shirts,Mens Plain T-Shirt Age Group: Adult
T-Shirts,Polyester Short Sleeves Plain Sublimation White Collar T-Shirts
T-Shirts,Different Available Ladies Breathable Thin Gym T-Shirt
T-Shirts,HAV2 T-Shirts
Sarees,White And Red Gajji Silk With Bandhani Saree
Sarees,Party Wear Pure Mercerised Cotton Silk Ladies Saree
Sarees,Silk Light Orange Kanjivaram Saree
Sarees,Party Wear Purple And Maroon Satin Solid-Plain Pack Of 2 Sari With Unstiched Blouse
Sarees,Cotton Dhanashree 6 Inch Saree Fall
Sarees,Ladies Plain Saree
Sarees,Casual Ladies Fancy Dupian Work Saree
Sarees,Cotton Silk Saree
Sarees,Multicolor Ladies Kerala Cotton Saree
Sarees,Ladies Soft Cotton Silk Saree
Sarees,Casual Womens Vichitra Silk Green  Saree With Blouse Piece
Sarees,Any Color Ladies Pure Silk 3D Kanjivaram Saree
Sarees,Women Silk Saree -6
Sarees,Black Attractive Pattern Sequence Saree With Blouse Piece
Sarees,Cotton Silk Rajkoti Patola Saree
Sarees,Party Wear Embroidery Bollywood Saree
Sarees,Multicolor Georgette Pure Raw Silk Saree
Sarees,Available In All Color Printed Saree
Sarees,Blue Fancy Work Sarees
Sarees,Multicolor Ladies Cotton Silk Saree
Sarees,Cotton Silk Embroiderd Saree
Sarees,Multicolor Ladies Designer Saree
Sarees,Green And Orange Bandhani Formal Sarees
Sarees,Forest Green Satin Silk Saree
Sarees,Organic Skin Friendly Smooth Finish Comfortable Saree
Sarees,Designer Net Saree
Sarees,Different Types Of Colors Available One Side Kottanchu Tie And Die Ladies Saree
Sarees,Hand Bandhani Sarees
Kurtis,Black Cotton Kurtis
Kurtis,Washable Ladies White Cotton Sharara Kurti With Dupatta
Kurtis,Light Blue Ladies Hand Embroidery Kurti
Kurtis,Washable Women Navy Blue Rayon Kurti
Kurtis,Washable Jaipuri Silk Kurti
Kurtis,10 Ladies Suit
Kurtis,KURTI 3PCS SET
Kurtis,Washable Ladies Modern Yellow Kurtis
Kurtis,Washable Ladies Printed Kurti
Kurtis,Rayon Kurti
Kurtis,Washable Ladies Embroidery Kurti
Kurtis,Indian Ladies Kurti
Kurtis,Washable Kurta Dupata Pant 3 Piece Kurti Set
Kurtis,Washable Pure Cotton Embroidered A Line Kurti
Kurtis,Dry Cleaning Perfect Finishing Ladies Kurtis
Kurtis,Washable Jaal Printed Off White Straight Kurta
Kurtis,ladies Kurtis
Kurtis,Cotton Designer Kurti
Kurtis,Rayon Kurti
Kurtis,Available In All Color Designer Kurti
Kurtis,Cotton Digital Printed Kurtis
Kurtis,Spring Ladies Designer Kurti
Kurtis,Washable Embroidery Lucknowi Angarkha Kurti
Kurtis,Washable Ladies Cotton Kurti
Kurtis,Washable Fancy Design Ladies Long Kurti With Long Sleeves
Kurtis,Ladies Casual Wear Short Sleeve V Neck Comfortable Cotton Embroidered Kurti
Kurtis,Chanderi Cotton Embrodered Work White Kurti
Kurtis,Pink Gown Style Digital Print Kurtis
Shirts,Lawman Slim Fit Shirt for Men
Shirts,Printed Beach Fancy Shirt
Shirts,Blue Mens 100% Cotton Printed Shirts
Shirts,White Mens Cotton Printed Shirt
Shirts,Washable Men Plain White Cotton Shirt
Shirts,Mens Shirts
Shirts,Different Available Men'S Formal Shirt (Satin Finish) Dark Green
Shirts,Arrow Shirts Collar Style: Straight
Shirts,Green Ladies Formal Shirts
Shirts,Casual Rival Shirts
Shirts,Men's Half Sleeve Polo T-Shirts
Shirts,Mens Casual Full Sleeve Shirts
Shirts,Washable Mens Formal Shirts
Shirts,Men Denim Shirt
Shirts,Washable Mens Cotton Shirt
Shirts,Washable Ladies White Cotton Shirt
Shirts,Blue Half Sleeves Plain Shirts
Shirts,Cotton Mens Shirts
Shirts,Washable Men'S Poplin Shirt
Shirts,Any Mens Printed Shirt
Shirts,Mens Lycra Casual Shirt Collar Style: Straight
Shirts,Washable Brasso Oversized Shirt
Shirts,Washable Mens Lycra Party Wear Striped Shirt
Shirts,Mens Denim Shirts
Shirts,Ladies Shirts Collar Style: Classic
Shirts,Private Label Acetate Shirt Collar Style: Pinned
Shirts,Quick Dry Mens Designer Slim Fit Solid Mustard Casual Shirt
Shirts,Casual Wear Men Full Sleeves Blue And White Dotted Plain Cotton Shirt
Bags & Cases,Designer Jute Shopping Bag
Bags & Cases,Card Case
Bags & Cases,Header Bags
Bags & Cases,Blue Leather Duffle Bag
Bags & Cases,Black Extruded Aluminum Apron Covers
Bags & Cases,"Carbon Steel 22 X 40 Inch Red Plastic Nesh Leno Bags, 50 Kg Storage Capacity"
Bags & Cases,Ladies Designer Duffle Bag
Bags & Cases,White Laundry Bag
Bags & Cases,Laundry Bags
Bags & Cases,Black Waterproof Bobby Bag
Bags & Cases,Aluminum Cases
Bags & Cases,Black Vaara Makeup Studio Led Case R602
Bags & Cases,Laminated Sacks
Bags & Cases,Premium Quality Stylish Durable School Bag
Bags & Cases,Plain Pet polyester Non woven Bag
Bags & Cases,Moisture Proof Leather Made Laptop Bag
Bags & Cases,Silver Scaffolding Lifting Bags
Bags & Cases,BOPP LAMINATED BAG
Bags & Cases,Various Brand Promotional Paper Bag
Bags & Cases,Designer Palm Leaf Bags Size: Medium Size
Bags & Cases,Navy Blue Loop Handle Grocery Bag
Bags & Cases,Eva Zip Closure Girls College Bags
Bags & Cases,Aluminum Carrying Cases Design: Plain
Bags & Cases,Ladies Sling Bag
Bags & Cases,Black Max1100H330 Waterproof Gun And Long Cases
Bags & Cases,Blue Lamination Bags
Bags & Cases,Pink Classic Repeat Bag
Bags & Cases,Black Depth Horizontal Case
Bags & Cases,Brown Round Gym Bag
Salwar Kameez,Indian Golden Black Salwar Suit With Dupatta
Salwar Kameez,Washable Attractive Look Womens Salwar Suits
Salwar Kameez,Indian Maroon Heavy Rayon Short Kurti For Womens E6
Salwar Kameez,Red Party Wear Suits
Salwar Kameez,Indian Beautiful Maroon Peplum Style Sharara Suit
Salwar Kameez,Ladies Printed Fashion Salwar Kameez with Dupatta
Salwar Kameez,Designer Pakistani Shanaya Suit
Salwar Kameez,Embroidery Salwar Kameez
Salwar Kameez,Available In All Color Green Minu Cotton Printed Salwar Suit
Salwar Kameez,No Fade Green Colour Modal Chanderi Embroidered Designer Palazzo Suits Sets
Salwar Kameez,Different Available Hand Embroidery Unstitched Suit
Salwar Kameez,Indian Pink Anarkali Suit
Salwar Kameez,Indian Ladies Modern Cotton Suit
Salwar Kameez,Cool Pass Jamnagar Bandhani Ladies Suit
Salwar Kameez,Indian Flamingo Pink Embroidery Salwar Suit
Salwar Kameez,Multicolour Ladies Designer Palazzo Suit
Salwar Kameez,Cool Pass Navy Blue Georgette Suit
Salwar Kameez,Indian Yellow Chanderi Silk Suit
Salwar Kameez,Women 3/4th Sleeves Designer Cotton Silk Suit
Salwar Kameez,Ladies Partywear Sharara Suit
Salwar Kameez,Designer Anarkali Suits
Salwar Kameez,Green Traditional Anarkali Suit
Salwar Kameez,Fancy Salwar Suit
Salwar Kameez,Pastel Green Ankle Length Full Sleeves Plain Dyed Designer Georgette Anarkali Suit
Salwar Kameez,Indian Ladies Kurti Pant With Dupatta
Salwar Kameez,Designer Printed Multi Colour Beautiful Georgette Salwar Suit With Digital Print Dupatta
Salwar Kameez,Multicolor Kavya Salwar Kameez
Salwar Kameez,Dry Cleaning Ladies Cotton Silk Salwar Kameez
Jeans,Lawman Pg3 PG3 GGREN-70104 SKNFT MDNGHBL
Jeans,Washable Men Denim Slim Fit Jeans
Jeans,Regular Mens Jeans
Jeans,Blue Men Denim Jeans
Jeans,Children Jeans
Jeans,Black Mens Premium Jeans
Jeans,3 Colors Mens Ruffed Jeans
Jeans,Mens Plain Jeans
Jeans,Denim Jeans
Jeans,Blue Ladies Denim Jeans
Jeans,Washable Mens Black Jeans
Jeans,Washable Mens Fancy Jeans
Jeans,Blue Skinny Jeans
Jeans,Multicolor Mens Jeans
Jeans,Finest Quality Cotton Denim Kids Jeans
Jeans,Mens Jeans Age Group: >16 Years
Jeans,Different Available Kids Denim Jeans
Jeans,Blue Mens Plain Denim Jeans
Jeans,Ladies Ripped Jeans
Jeans,Washable Ladies Blue Jeans
Jeans,Blue Men Denim Jeans
Jeans,Denim Cargo Jeans
Jeans,Men'S Jeans
Jeans,Washable Casual Wear Stretchable Denim Jeans
Jeans,Trifoi Jeans With Bill Age Group: >16 Years
Jeans,Breathable Ladies Black Denim Jeans
Jeans,Men Jeans Age Group: >16 Years
Jeans,Summer Mens Fancy Denim Jeans
Children Clothing,Cotton Kids Round Neck T-Shirt
Children Clothing,Girl Pink Pajama Age Group: Kids
Children Clothing,Kids Wear
Children Clothing,Kids Full Sleeves Plain Cotton Shirts For Casual Wear Size: Extra Large
Children Clothing,Stylish Kids Wear
Children Clothing,Girls Frock Age Group: 5 To 11
Children Clothing,Modern Girls Fancy Dress
Children Clothing,Jacquard Girls Sweat Shirt
Children Clothing,Grey Kids Plain Blazers
Children Clothing,Kids Clothes
Children Clothing,Childrens Bloomer
Children Clothing,Kids Top and Skirt Set
Children Clothing,Blue Golden Girls Fashion Dress
Children Clothing,Cc-111 Boys Popcorn Cotton T-Shirt
Children Clothing,White Kids Fancy Plain T Shirt
Children Clothing,Washable Girls Knitted Shorts
Children Clothing,kids sarara pair
Children Clothing,Different Available Kids Hot Pant
Children Clothing,Multicolor Kids Black Denim Jeans
Children Clothing,Kids Round Neck T-Shirts Age Group: 6-12 M
Children Clothing,Kids Sports T-shirt
Children Clothing,Baba Suits
Children Clothing,Girls Dress Age Group: 3-5
Children Clothing,Multicolor Boys Knit Top And Denim Pant
Children Clothing,Kids Dungarees Age Group: 3-7
Children Clothing,Multiple Girls Nightwear Set
Children Clothing,Yellow Girls Sharara Suit
Children Clothing,Washable Girls Rose Ballet Frock
Skirts & Tops,Pink Plain Cotton Skirts
Skirts & Tops,Assorted Ladies Floral Print Knee Length Sleeveless Western Top For Casual Wear
Skirts & Tops,Ladies Cheetah Print Crop Top
Skirts & Tops,Printed Short Sleeves Ladies Designer Tops
Skirts & Tops,Party Wear Baby Girl Dress
Skirts & Tops,Black Ladies Formal Skirts
Skirts & Tops,Maroon Round Neck Rayon Ladies Top For Casual Wear
Skirts & Tops,As Per Buyer Requirement Bci Cotton Ladies Skirts
Skirts & Tops,Plain Bandhani Tops
Skirts & Tops,Pink Color Full Sleeve Casual Top
Skirts & Tops,Plain Ladies Black Rayon Long Top
Skirts & Tops,Multicolor Ladies Plain Tops
Skirts & Tops,Black Mens Tank Top
Skirts & Tops,Girls Designer Tops
Skirts & Tops,Pink Ladies Seamless Lace Blouse
Skirts & Tops,Blue And Beige Ombre Georgette Dress
Skirts & Tops,100% Cotton and Poly Cotton 160 GSM Girls Casual Tops
Skirts & Tops,Multicolor Machine Made Crochet Tops For Ladies
Skirts & Tops,Multicolor Back Tie Up Ethnic Top
Skirts & Tops,Solid Color Casual Shirt
Skirts & Tops,Knitted Fashionable Ladies Short Tops
Skirts & Tops,Casual Dress Ladies Printed Tops
Skirts & Tops,Available In All Color Ladies Floral Printed Top
Skirts & Tops,Yelloe Full Sleeves Ladies Printed Crop Tops
Skirts & Tops,Ladies Printed Crepe Tops
Skirts & Tops,Silk Printed Skirt
Skirts & Tops,Different Available Cross Two-Piece Outfits Skirt
Skirts & Tops,Ladies Multicolor Flower Printed Casual Top
Gloves & Mittens,Orange Industrial Rubber Hand Gloves
Gloves & Mittens,Electrical Shock Proof Seamless Rubber Hand Gloves
Gloves & Mittens,White Latex Exam Powder Free Gloves - Small
Gloves & Mittens,Water Proof Sterile Surgical Gloves
Gloves & Mittens,Washable Industrial Orange Rubber Hand Gloves
Gloves & Mittens,Yellow 18 Inch Supported Hand Gloves
Gloves & Mittens,Full Fingered Blue Nitrile Hand Gloves
Gloves & Mittens,Cryo Gloves
Gloves & Mittens,Latex Gloves
Gloves & Mittens,Leather Gauntlets Hand Mittens For Welder
Gloves & Mittens,Sterile Latex Gloves
Gloves & Mittens,Dotted Gloves 8oz Cotton and Poly
Gloves & Mittens,White Latex Examination Gloves
Gloves & Mittens,Hand Gloves
Gloves & Mittens,Milky White Latex Examination Gloves Powder Free/Powdered
Gloves & Mittens,3PLY FACE MASK
Gloves & Mittens,Washable Non-Asbestos Hand Gloves
Gloves & Mittens,Aloe Nitrile Gloves
Gloves & Mittens,Vinyl Examination Gloves Blue Dimension (L*W*H): 5*5 Inch (In)
Gloves & Mittens,Mitten Glove
Gloves & Mittens,White Sterile Latex Surgical Gloves Powder Free
Gloves & Mittens,White Lycra Hosiery Hand Gloves
Gloves & Mittens,Green Welding Hand Gloves
Gloves & Mittens,Green Laboratory Gloves
Gloves & Mittens,Blue Disposable Medical Latex Gloves
Gloves & Mittens,Fireman Gloves
Gloves & Mittens,Hand Gloves
Gloves & Mittens,Blue Non Sterile Latex Examination Gloves
Gloves & Mittens,White Latex Examination Gloves
Menswear,Glittering Look Easies Capris
Menswear,Multicolor Mens Hooded Sweatshirts
Menswear,Dry Cleaning Formal Suit
Menswear,Indian Mens White Khadi Kurta With Pyajama
Menswear,Mens Wear
Menswear,Plain Formal Coat Pant
Menswear,Mens Black Mandala Print Hoodies
Menswear,Cotton Mens Pink Linen Kurta
Menswear,Gray Ladies Winter Sweatshirts
Menswear,Casual Trousers
Menswear,LEXON LYCRA STRETCHABLE REGULAR FIT CARGO POCKETS  JOGGERS TRACK PANT FOR MEN
Menswear,Cotton Hoodies Cap
Menswear,Dry Cleaning Grey Color Men Lower
Menswear,Cotton Mens Black Short Kurta
Menswear,Washable Mens Sherwani
Menswear,Multicolor Mens Cotton Fancy Capri
Menswear,No Fade Mens Blue Jogger
Menswear,Steel Readymade Garments
Menswear,Maroon Mens Full Sleeve Shirt
Menswear,Washable Mens Ink Polo T-Shirts
Menswear,Washable Mens Sleevesless Sandow T-Shirt
Menswear,Yarn Dyed Kurta Pajama
Menswear,Multiple Mens Zipper Sweatshirt
Menswear,Ideal and Comfortable  Sportswear
Menswear,Washable Mens Slim Fit Plain Kurta
Menswear,Washable Mens Printed Sweatshirts
Menswear,Mens Gym Wear Track Lower
Menswear,Mens Official Blazer
Pants & Trousers,Beach Pants
Pants & Trousers,Track Pants
Pants & Trousers,Straight Fit Ladies Black Cotton Regular Pants
Pants & Trousers,White Mens Grey Cotton Pant
Pants & Trousers,Plain Mens Brown Pant
Pants & Trousers,White Men Plain Trousers
Pants & Trousers,Fancy Gents Trousers
Pants & Trousers,Various Colors Are Available Plain Mens Sweat Pants
Pants & Trousers,No Fade Mens Plain Pant
Pants & Trousers,Washable Plain Lycra Mens Pant
Pants & Trousers,No Fade Mens Cotton Pants
Pants & Trousers,4 Light Weight Men'S Jogger
Pants & Trousers,Washable Ladies Linen Trousers
Pants & Trousers,Sportswear Track Pants
Pants & Trousers,Multiple Perfect Fit Track Pant
Pants & Trousers,Available In Different Color Mens Cotton Pants
Pants & Trousers,Off White Beige Waist Elasticated Straight Pant
Pants & Trousers,Washable Mens Formal Cotton Pants
Pants & Trousers,Various Track Pants For Mens
Pants & Trousers,Mens Formal Trousers
Pants & Trousers,Canvas Ladies Plain Formal Pant
Pants & Trousers,Washable Mens Casual Cotton Pant
Pants & Trousers,Multicolored Ladies Custom Design Linen Pants
Pants & Trousers,Red Ladies Cotton Pant
Pants & Trousers,Different Available Ladies Rayon Trouser
Pants & Trousers,Quick Dry Mens Slim Fit Black Cotton Blend Trouser
Pants & Trousers,Mens Casual Trousers
Pants & Trousers,Breathable Blue Harem Pants
Watches & Clocks,GPS Synchronized Clock
Watches & Clocks,World Clock
Watches & Clocks,Brown Adorning Clock
Watches & Clocks,Acrylic Butterfly Wall Clock
Watches & Clocks,Black Gear Clock
Watches & Clocks,"Available In Different Colors A128 Table Clock With Double Pen Holder And Card Holder, Branding Included"
Watches & Clocks,Black Polo Club Watch
Watches & Clocks,Synchronous Master Slave Clock
Watches & Clocks,Black Digital Lcd Stopwatch
Watches & Clocks,Blue Touch Screen Smart Watch
Watches & Clocks,Marble Polished Decorative Watch
Watches & Clocks,Digital Clock
Watches & Clocks,Acrylic White Clock
Watches & Clocks,Multiple Color Special Design For Wall Clock
Watches & Clocks,Iron Table Clock
Watches & Clocks,White Digital Alarm Clock
Watches & Clocks,Silver Ss Wall Clock Outer
Watches & Clocks,Table Top Clock Frame With Pen Holder Core Material: Solid Wood
Watches & Clocks,Silver And Blue Polo Newyark Watch Suppliers
Watches & Clocks,Qua Wall Clock
Watches & Clocks,Wristwatch Desire Watch Pair
Watches & Clocks,Wooden Clocks in Bulk Manufacturers
Watches & Clocks,Black Gps Digital Clock
Watches & Clocks,Ball Watches
Watches & Clocks,Cuckoo Clock
Watches & Clocks,Digital Display Clock
Watches & Clocks,Sublimation Clock
Watches & Clocks,Wall Clock For Interior Home Decoration
Baby & Infant Products,Lexofor Product Liquid
Baby & Infant Products,Natural Nourishing Baby Lotion Capacity: 145 To 1400 Ltrs./Hr. Liter/Day
Baby & Infant Products,Plastic Baby Potty Sitter
Baby & Infant Products,Disposable Cotton White Baby Diaper Size: Different Available
Baby & Infant Products,Multi Colored Baby Towels
Baby & Infant Products,Baby Portable Changing Pad Diaper Bag
Baby & Infant Products,Best Price Baby Lotion
Baby & Infant Products,General Baby Cot
Baby & Infant Products,Plastic Baby Chair
Baby & Infant Products,BABY CRADEL ABS
Baby & Infant Products,Star Models Baby Cushion
Baby & Infant Products,All Color Educational Toys Baby Walker
Baby & Infant Products,62 Pieces Baby Diaper
Baby & Infant Products,Daily Usable Lightweight Plastic Baby Comb For Hair
Baby & Infant Products,Body Temperature Medical Infrared Thermometer
Baby & Infant Products,Silver Tinytyke Baby Rocks Standard Automatic Baby Cradle
Baby & Infant Products,Off White Baby Shampoo
Baby & Infant Products,White Skinic Herbal Extract Baby Wipes
Baby & Infant Products,White Disposable Baby Diapers
Baby & Infant Products,Golden Glass Dropper Hardness: Soft
Baby & Infant Products,Baby Cradle
Baby & Infant Products,Black Four Wheeled Easy To Operate Standard Rollator Cristallo
Baby & Infant Products,Cotton Baby Towel
Baby & Infant Products,Blue Baby Walker Without Rocking
Baby & Infant Products,Baby Shampoo
Baby & Infant Products,Kids Garments
Baby & Infant Products,Infant Milk Powder Stage-1
Baby & Infant Products,Baby Care Teether
Jackets,Washable Ladies Denim Jacket
Jackets,Winter Jackets With Hood
Jackets,Mens Plain Jodhpuri Jacket Age Group: Adult
Jackets,Washable Blue Varsity Jackets
Jackets,Designer Jacket Chest Size: 23.5
Jackets,Black Plain Nehru Jackets
Jackets,Mens Suits Blazers
Jackets,Mens Premium Jackets Age Group: Adult
Jackets,Breathable Mens Full Sleeves Woolen Plain Hoodies
Jackets,Multiple Plain Full Sleeves Mens Winter Jacket With Hoodie
Jackets,Black U.S Polo Bomber Jacket
Jackets,Black Mens Sports Jackets
Jackets,Wedding Mens Half Coat
Jackets,Multi Color Full Sleeves Casual Wear Man Hoodies
Jackets,Kevlar Jacket
Jackets,Safety Jacket
Jackets,Dry Cleaning Ladies Jacket
Jackets,Multicolor Mens Full Sleeve Jackets
Jackets,Kids Knitted Jackets
Jackets,Safety Jacket
Jackets,Blue Men Cotton Hooded Jacket
Jackets,Blue Corduroy Jackets Age Group: 20-55 Years
Jackets,6 Color Available Art 10 Tpu Boys Jacket 3Xl Size
Jackets,Washable 1127 Sportswear Jackets
Jackets,Mint Green Mens Cotton Kurta Jacket
Jackets,Black Mens Premium Jacket
Jackets,Solas Life Jacket (Mi-500C) Age Group: Adult
Jackets,Leather Patch Jacket
Ladies Handbags,Red Ladies Leather Clutch
Ladies Handbags,Ladies Hand Bag
Ladies Handbags,Ladies Back Pack & Sling Bag Size: 27X23 Cm
Ladies Handbags,Pink Ladies Hand Bags With Wallet
Ladies Handbags,Ladies Braided Bags Design: Modern
Ladies Handbags,Ladies Leather Bag
Ladies Handbags,Brown Single Fold Leather Ladies Wallet
Ladies Handbags,Multicolor Cotton Beach Handbags
Ladies Handbags,Customized Leather Stylish Women Handbags
Ladies Handbags,Ladies Leather Bag in Bulk
Ladies Handbags,1000 ML Tritan Bottle
Ladies Handbags,Ladies Handbags
Ladies Handbags,Black Ladies Leather Handbag
Ladies Handbags,Ladies Denim Fabric Hand Bags Gender: Women
Ladies Handbags,Ladies Casual Handbag Gender: Women
Ladies Handbags,Peach Gold Floral Rhinestone Round Clutch
Ladies Handbags,Rattan Bag or bali bags
Ladies Handbags,Pink Modern Style Portable Designer Zipper Closure Leather Makeup Bags
Ladies Handbags,Green Ladies Cotton Canvas Handbag
Ladies Handbags,Multicolour Handbags Purse Combo
Ladies Handbags,Ladies Pure Leather Hand Bag Gender: Women
Ladies Handbags,RENE Genuine Leather Tan Color Coin Pouch R-507-TAN
Ladies Handbags,Different Available Ladies Leather Hand Bags
Ladies Handbags,Ladies Leather Handbag Gender: Women
Ladies Handbags,Round Chickenkari Potli with Double Side Embroidery
Ladies Handbags,Brown Leather Clutch Gender: Women
Ladies Handbags,Brown Ladies Pu Handbag
Ladies Handbags,Different Colors Available Modern Handicraft Handbag
Leather Bags,Leather Office Bag
Leather Bags,Bobby Bag Gender: Unisex
Leather Bags,Ladies Leather Bag Design: Modern
Leather Bags,High Quality Black Leather Cross Briefcase Bag Pack of 1 Set
Leather Bags,Printed Jute Leather Bag
Leather Bags,Premium Quality Black Color Office Bags Gender: Men
Leather Bags,2 Compartment Laptop Bag Size: 40X30X6Cm
Leather Bags,Brown Leather Messenger Laptop Bag
Leather Bags,Black Red Adjustable Strap Leather Laptop Bags
Leather Bags,As Per Availability Ladies Leather Hand Bag
Leather Bags,Premium Leather Finish 15.6 Inches Laptop Bags
Leather Bags,Plain Yellow Leather Bag
Leather Bags,Dark Brown Leather Luggage Bag
Leather Bags,Executive Bag
Leather Bags,Different Available Synthetic Leather Messenger Bag
Leather Bags,Fashion Plain Brown Leather Shoulder Bags For Office
Leather Bags,Plain Leather Soldier Bag
Leather Bags,Different Available Ladies Leather Sling Bag
Leather Bags,Yellow Leather Office Messenger Bag
Leather Bags,Laptop Bags
Leather Bags,Leather Size Adjustable Waist Bag
Leather Bags,Dark Brown Office Leather Laptop Bag
Leather Bags,Small Leather Bag Gender: Women
Leather Bags,Brown Genuine Leather Attache Briefcase For Men
Leather Bags,Leather Briefcase Bag Gender: Unisex
Leather Bags,GENUINE LEATHER TAN PROFESSIONAL BAG
Leather Bags,802 Leather Kit Bag
Leather Bags,Brown Laptop Bag
Undergarments,High Quality Ladies Bikini Age Group: 3-12 Yrs
Undergarments,White Ladies Plain Cotton Bra
Undergarments,8 Mens Brief
Undergarments,Pista Green Plain Full Sleeve Ladies Thermal Wear
Undergarments,Blue Kids Cotton Underwear
Undergarments,Pink Ragini Ladies Bra
Undergarments,Blue Woman Undergarments
Undergarments,White Inner Wear
Undergarments,Padded Ladies Lace Camisole Bralette
Undergarments,Knitted 100% Cotton & Poly Cotton 160 Gsm Girls Casual Camisole Top
Undergarments,10 Colors Mens Printed Sando
Undergarments,"Plain White Disposable Male Brief, Spun Lace, XL, XXL, XXXL Size"
Undergarments,Army Woolen Inner Wear
Undergarments,Silk Sleeveless Hot Pink Corset For Ladies
Undergarments,Beige And Brown Gynecomastia Compression Vest Long
Undergarments,Angelina Fancy Bikini Set
Undergarments,Mens Undergarments
Undergarments,Bra Bust Pad
Undergarments,Fancy Printed Hipster Panty
Undergarments,Heron Hipster Panties
Undergarments,Mens Cotton White Vest
Undergarments,Green High Quality Solid Lace Wireless Bra
Undergarments,Ladies Short Undergarments
Undergarments,Different Available Plain Ladies Bra
Undergarments,Cotton Bruchi Club Antibacterial Bamboo Briefs For Men White Blue
Undergarments,Black Denim Leather Belt Goth Steampunk Corset Overbust Plus Size Waist Trainer
Undergarments,Blue 2 Pcs Halter Strap Neck Tie Triangle Bathing Suit Bikini Set
Undergarments,Multicolor Ladies Plain Cotton Panties
Uniforms & Workwear,Seam Sealed Protective Coverall Gender: Unisex
Uniforms & Workwear,Spring Orange Hi Visibility Safety Vest
Uniforms & Workwear,High Density Polyethylene Fiber Coverall Gender: Unisex
Uniforms & Workwear,Army Uniforms
Uniforms & Workwear,White Chef Coat
Uniforms & Workwear,Flame Retardant Cloth Application: A A A  Textile Machine A A A  Boiler A A A  Pipe Lines A A A  Power Stations A A A  Ships For Thermal Insulation A A A  Fire Protection
Uniforms & Workwear,Fibredyed/Dope Dyed Colors Police Uniform Fabric
Uniforms & Workwear,Lab Coat For Pharma Industry
Uniforms & Workwear,Orange Petrol Pumps T-Shirts Gender: Male
Uniforms & Workwear,Full Body Cotton Coverall
Uniforms & Workwear,Chef Coat Uniform
Uniforms & Workwear,Uniform Quality Fabric Cotton Coverall
